name,role,email,job
Rolf Emmerich,Festival Leitung,rolf.emmerich@sommerblut.de,"Die Festivalleitung trägt vor allem die Verantwortung von allem. Sie hat bei allem das letzte Wort, außer bei inhaltlichen Entscheidungen in den einzelnen Produktionen. "
Hannah Lina Schneeberger,Öffentlichkeitsarbeit,hannah.lina.schneeberger@sommerblut.de,Die Öffentlichkeitsarbeit beantwortet zum Beispiel Fragen der Presse oder betreut die Berichterstattung im Internet.
Anna Mareen Henke,Künstlerische Leitung,anna.mareen.henke@sommerblut.de,Die künstlerische Leitung ist für die inhaltliche Programmauswahl zuständig: Welche Stücke werden in diesem Jahr präsentiert?
Hanna Behr,Festivalmanagement,hanna.behr@sommerblut.de,Das Festivalmanagement führt das Festival nach den Wünschen der Festivalleitung durch.
Katharina Würzberg		,Inklusionsbeauftragte,katharina.wuerzberg@sommerblut.de,"Die Person für Inklusion kümmert sich um einen gleichen Zugang zum Festival für alle Menschen. Sie ist auch ansprechbar, falls jemand Deskriminierendes oder Sexistisches Verhalten erlebt hat."
,,,